{
  "schema_version": "v1",
  "updated_at": "2026-06-12T12:00:00+00:00",
  "stale": false,
  "providers": {
    "codex": {
      "quota": {
        "label": "Codex",
        "remaining_percent": 80.0,
        "used_percent": 20.0,
        "reset_at": "2026-06-12T13:34:00+00:00",
        "reset_in": "1h 34m",
        "window": "5h",
        "source": "codex app-server account/rateLimits/read",
        "updated_at": "2026-06-12T12:00:00+00:00",
        "status": "ok",
        "error": null,
        "buckets": [
          {
            "id": "codex:primary",
            "label": "codex 5h",
            "remaining_percent": 80.0,
            "used_percent": 20.0,
            "reset_at": "2026-06-12T13:34:00+00:00",
            "reset_in": "1h 34m",
            "window": "5h",
            "status": "ok"
          }
        ]
      },
      "today": {
        "input_tokens": 60000,
        "output_tokens": 3456,
        "cache_tokens": 60000,
        "total_tokens": 123456
      },
      "hourly": [
        {
          "hour": 12,
          "input_tokens": 60000,
          "output_tokens": 3456,
          "cache_tokens": 60000,
          "total_tokens": 123456
        }
      ]
    }
  }
}
